dataset,final_category,final_category_zh,canonical_sample_id,sample_file,source_problem_id,question,question_zh,translation_status,answer,question_units,complexity_index
physics\seephys,mechanics_kinematics_dynamics,力学、运动学与动力学,seephys01410,seephys01410.json,7,Consider the motion of an object given by the position vs. time graph shown. At what time is the speed of the object greatest?,考虑由图示位置-时间图给出的物体运动。物体在哪一时刻速度最大？,human_curated_zh,$t=4.0$ s,24,7.8997
physics\seephys,electromagnetism_circuits,电磁学与物理电路,seephys00215,seephys00215.json,122,"Refer to Fig. 3.25. After a long time in position B, what are the currents in $\varepsilon_{2}$, $R_{1}$, $R_{2}$ and $L$?",参考图 3.25。开关在位置 B 保持很长时间后，$\varepsilon_2$、$R_1$、$R_2$ 和 $L$ 中的电流分别是多少？,human_curated_zh,"$I_{R_{1}}=1\,\mathrm{mA}$ (rightward), $I_{R_{2}}=0$, $I_{L}=1\,\mathrm{mA}$ (upward), $I_{\varepsilon_{2}}=1\,\mathrm{mA}$ (downward)",24,7.8945
physics\seephys,waves_optics_sound,波动、光学与声学,seephys00223,seephys00223.json,208,Find the reflection and transmission coefficients for the one-dimensional potential step shown in Fig. 1.27 if the particles are incident from the right.,对于图 1.27 所示的一维势阶，若粒子从右侧入射，求反射系数和透射系数。,human_curated_zh,"$|R|^{2}=\left|\frac{k_{1}-k_{2}}{k_{1}+k_{2}}\right|^{2}=\frac{V_{0}^{2}}{(\sqrt{E}+\sqrt{E-V_{0}})^{4}}$, $|S|^{2}=1-|R|^{2}=1-\frac{V_{0}^{2}}{(\sqrt{E}+\sqrt{E-V_{0}})^{4}}$",24,7.2369
physics\seephys,physics_conceptual_judgement,物理概念判断,seephys00319,seephys00319.json,112,In which Regions is there a place on the x-axis (aside from infinity) at which the electric potential is equal to zero?,在哪些区域中，x 轴上（无穷远除外）存在电势等于零的位置？,human_curated_zh,Both Regions II and III,23,6.8735
physics\seephys,thermo_fluids_gases,热学、流体与气体,seephys00343,seephys00343.json,148,A student uses a negative temperature coefficient thermistor in the circuit of Fig. 7.1 to indicate changes in temperature. Calculate the potential at point X.,一名学生在图 7.1 的电路中使用负温度系数热敏电阻来指示温度变化。计算 X 点的电势。,human_curated_zh,$0.40 V$,25,7.5541
physics\seephys,physical_circuit_application,物理电路应用,seephys00531,seephys00531.json,200,An ideal operational amplifier (op-amp) is incorporated into the circuit shown in Fig. 7.1. Calculate the gain G of the amplifier circuit.,一个理想运算放大器接入图 7.1 所示电路。计算该放大电路的增益 G。,human_curated_zh,9.0,23,7.1938
physics\seephys,modern_quantum_nuclear_relativity,近代物理、量子与相对论,seephys01119,seephys01119.json,891,A student investigates a radioactive substance in a laboratory. Fig. 11.1 is a graph showing the count rate detected as the substance decays for 7.5 minutes. The background radiation is 20 counts/min. Determine the half-life of the substance.,一名学生在实验室研究放射性物质。图 11.1 显示该物质衰变 7.5 分钟内探测到的计数率，背景辐射为 20 次/分钟。求该物质的半衰期。,human_curated_zh,$2.4 \mathrm{~min}$,40,8.9009
physics\seephys,graph_data_interpretation,物理图像与数据解读,seephys01411,seephys01411.json,412,The position vs. time graph of an object moving on a horizontal line is shown. At what time is the object moving with its greatest speed?,图中给出了物体沿水平线运动的位置-时间图。物体在哪一时刻速度最大？,human_curated_zh,"$t=3.0 \, \mathrm{s}$",26,7.5698
physics\seephys,astronomy_gravity_orbits,天体引力与轨道,seephys01201,seephys01201.json,1360,"欲使卫星完全脱离地球的束缚,则 $u_{1}$ 的最小值应为多大?以 $u_{0}$ 表示",欲使卫星完全脱离地球束缚，$u_1$ 的最小值应为多少？用 $u_0$ 表示。,human_curated_zh,$\sqrt{2} u_{0}$,29,5.858
