dataset,final_category,final_category_zh,canonical_sample_id,sample_file,source_problem_id,question,question_zh,translation_status,answer,question_units,complexity_index
biology\ai2d_biology,cell_molecular_genetics,细胞、分子与遗传,ai2d_biology00297,ai2d_biology00297.json,938,"Which organelle is small cavity in the cytoplasm of a cell, bound by a single membrane and containing water, food, or metabolic waste?e",哪种细胞器是细胞质中的小腔室，由单层膜包裹，含有水、食物或代谢废物？,human_curated_zh,Vacuole,24,6.9795
biology\ai2d_biology,ecology_food_web_population,生态、食物网与种群,ai2d_biology00786,ai2d_biology00786.json,2436,"In the food web above, which of the following animals will most immediately need to find a new food source after a grass fire?",在上方食物网中，草地火灾后，以下哪种动物最需要立即寻找新的食物来源？,human_curated_zh,Goat,24,6.7952
biology\ai2d_biology,biology_other,生物综合识图,ai2d_biology00631,ai2d_biology00631.json,1232,Label A shows what appears to be a clover. What is the technical name for its shape?,标注 A 显示的似乎是一株三叶草。它的形状在术语上叫什么？,human_curated_zh,Trifoliate,17,7.3883
biology\ai2d_biology,plant_biology,植物结构与功能,ai2d_biology00811,ai2d_biology00811.json,2679,Which flower type has a flat-topped or rounded flower cluster in which the individual flower stalks arise from about the same point?,哪种花序具有平顶或圆顶状花簇，且各个小花梗大约从同一点长出？,human_curated_zh,umbel,23,6.8611
biology\ai2d_biology,anatomy_physiology,解剖与生理结构,ai2d_biology00932,ai2d_biology00932.json,1374,"Name the usually green, flattened, lateral structure attached to a stem and functioning as a principal organ of photosynthesis and transpiration in most plants.",请说出通常为绿色、扁平、侧生于茎上，并在多数植物中作为光合作用和蒸腾作用主要器官的结构名称。,human_curated_zh,leaf,24,6.6916
biology\ai2d_biology,life_cycle_development,生命史与发育阶段,ai2d_biology00566,ai2d_biology00566.json,1882,"What stage in a frog's life cycle represents a limbless aquatic larva of a frog or toad, having gills and a long flat tail.",青蛙生命周期中的哪一阶段表示没有四肢、生活在水中、具有鳃和长扁尾的蛙或蟾蜍幼体？,human_curated_zh,tadpole,24,6.7182
biology\ai2d_biology,biochemistry_enzymes_metabolism,生化酶与代谢,ai2d_biology00587,ai2d_biology00587.json,1505,"Using the diagram, what letter depicts where glucose is formed?",根据这张图表，蛇属于哪种类型的肉食动物？,human_curated_zh,F,10,6.3385
biology\ai2d_biology,experimental_graph_data,实验与数据图表,ai2d_biology00053,ai2d_biology00053.json,467,A snake is what type of carnivore according to this chart?,根据这张图表，蛇属于哪种类型的肉食动物？,human_curated_zh,primary,11,6.1134
