dataset,final_category,final_category_zh,canonical_sample_id,sample_file,source_problem_id,question,question_zh,translation_status,answer,question_units,complexity_index
physics\multi_physics,mechanics_kinematics_dynamics,力学、运动学与动力学,multiphysics00379,multiphysics00379.json,29,某质点做直线运动，其位移x与时间t的关系图象如图所示。则,某质点做直线运动，其位移 x 与时间 t 的关系图象如图所示。则应选择哪项结论？,human_curated_zh,在0~20 s时间内质点的平均速度大小为0.8 m/s,26,7.2599
physics\multi_physics,electromagnetism_circuits,电磁学与物理电路,multiphysics00420,multiphysics00420.json,data_8_00096,如图所示，为A、B两电阻的伏安特性曲线，关于两电阻的描述正确的是（ ）,如图所示，为 A、B 两电阻的伏安特性曲线。关于两电阻的描述，正确的是哪一项？,human_curated_zh,在两图线交点处，电阻A的阻值等于电阻B,29,6.67
physics\multi_physics,physics_conceptual_judgement,物理概念判断,multiphysics00320,multiphysics00320.json,52,一质点由静止开始按如图所示的规律运动，下列说法正确的是,一质点由静止开始按图示规律运动，下列说法正确的是哪一项？,human_curated_zh,AC,26,7.6225
physics\multi_physics,waves_optics_sound,波动、光学与声学,multiphysics00451,multiphysics00451.json,data_8_00106,如图所示电路，L1发光，L2、L3不亮，A1有读数，A2没有读数，则产生的故障应是（只有一处有故障）。,如图所示电路中，L1 发光，L2、L3 不亮，A1 有读数，A2 没有读数，则故障应是什么（只有一处故障）？,human_curated_zh,灯泡L2短路,42,7.8832
physics\multi_physics,graph_data_interpretation,物理图像与数据解读,multiphysics00371,multiphysics00371.json,69,如图所示为甲、乙两质点从同一点做直线运动的 v-t 图像。由图像可得,如图所示为甲、乙两质点从同一点做直线运动的 v-t 图像。由图像可得什么结论？,human_curated_zh,在 t=5s 时刻，甲、乙相距 lm,29,7.5164
physics\multi_physics,astronomy_gravity_orbits,天体引力与轨道,multiphysics00377,multiphysics00377.json,812,设“珞珈一号”在半径为R的圆周轨道上运行，经过时间t，转过的角度为θ。已知引力常量为G。下列说法正确的是( ),设“珞珈一号”在半径为 R 的圆周轨道上运行，经过时间 t 转过角度 θ。已知引力常量为 G。下列说法正确的是哪一项？,human_curated_zh,BCD,45,7.0446
physics\multi_physics,physical_circuit_application,物理电路应用,multiphysics00080,multiphysics00080.json,183,如图所示，在一空心螺线管内部中点处悬挂一铜环，电路接通瞬间，下列说法正确的是( ),如图所示，在一空心螺线管内部中点处悬挂一铜环。电路接通瞬间，下列说法正确的是哪一项？,human_curated_zh,BC,35,8.0724
physics\multi_physics,thermo_fluids_gases,热学、流体与气体,multiphysics00388,multiphysics00388.json,859,假设将来一艘飞船靠近火星时，经历如图所示的变轨过程，则下列说法正确的是（ ）,假设将来一艘飞船靠近火星时经历图示变轨过程，则下列说法正确的是哪一项？,human_curated_zh,若轨道Ⅰ贴近火星表面，测出飞船在轨道Ⅰ上运动的周期，就可以推知火星的密度,33,7.259
physics\multi_physics,modern_quantum_nuclear_relativity,近代物理、量子与相对论,multiphysics00477,multiphysics00477.json,data_7_00089,【2017·江苏卷】如图所示，三块平行放置的带电金属薄板A、B、C中央各有一小孔，小孔分别位于O、M、P点。由O点静止释放的电子恰好能运动到P点。现将C板向右平移到P'点，则由O点静止释放的电子,【2017·江苏卷】如图所示，三块平行放置的带电金属薄板 A、B、C 中央各有一小孔，小孔分别位于 O、M、P 点。由 O 点静止释放的电子恰好能运动到 P 点。现将 C 板向右平移到 P' 点，则由 O 点静止释放的电子会如何运动？,human_curated_zh,运动到P点返回,81,8.5235
