dataset,final_category,final_category_zh,canonical_sample_id,sample_file,source_problem_id,question,question_zh,translation_status,answer,question_units,complexity_index
geography\geosqa,climate_weather_seasons,气候、天气与季节,geosqa00688,geosqa00688.json,458,"读下图,回答下列各题。 <image1> 该流域所属气候类型最可能是",读下图，回答下列各题。<image1> 该流域所属气候类型最可能是？,human_curated_zh,热带季风气候,24,7.756
geography\geosqa,population_urban_economic,人口、城市与经济地理,geosqa00352,geosqa00352.json,930,"读下图,回答下列各题。 <image1> Q地为该城市规划预留地,最适宜建()",读下图，回答下列各题。<image1> Q 地为该城市规划预留地，最适宜建设什么？,human_curated_zh,高新技术区,26,7.8608
geography\geosqa,chart_graph_interpretation,图表信息解读,geosqa00979,geosqa00979.json,598,"读图,回答下列小题。 <image1> 下面关于尼罗河的叙述,正确的是",读图，回答下列小题。<image1> 关于尼罗河的叙述，正确的是哪一项？,human_curated_zh,以雨水补给为主,24,7.8322
geography\geosqa,map_topography_location,地图、地形与区位,geosqa00396,geosqa00396.json,442,"读“某国2°E经线附近气温、降水量分布图”,完成小题。 <image1> 图中( )",读“某国 2°E 经线附近气温、降水量分布图”，完成小题。<image1> 图中表示的情况是？,human_curated_zh,"乙地由于地形因素影响,年降水量高于甲和丙",25,8.7437
geography\geosqa,geography_other,地理综合题,geosqa00229,geosqa00229.json,3639,"读图,完成下列各题。 <image1> 此图反映的影响地租高低的因素是 ( )",读图，完成下列各题。<image1> 此图反映的影响地租高低的因素是什么？,human_curated_zh,与市中心的距离,25,7.6697
geography\geosqa,earth_sun_moon_space,地球、太阳与月相,geosqa01066,geosqa01066.json,3727,"读图,完成: <image1> 年太阳总辐射量3地小于1地的主要原因是",读图，完成题目：<image1> 年太阳总辐射量 3 地小于 1 地的主要原因是什么？,human_curated_zh,"地势低,云量多",25,8.799
geography\geosqa,hydrology_ocean_rivers,水文、河流与海洋,geosqa00401,geosqa00401.json,2881,"读图,回答问题。 <image1> 关于图中河流流向的说法,正确的是 ( )",读图，回答问题。<image1> 关于图中河流流向的说法，正确的是哪一项？,human_curated_zh,自西北向东南,23,8.3009
geography\geosqa,agriculture_resources_environment,农业资源与环境,geosqa00443,geosqa00443.json,2766,"读下图,完成小题。 <image1> 图示区域城镇面临的主要环境问题是()",读下图，完成小题。<image1> 图示区域城镇面临的主要环境问题是什么？,human_curated_zh,土地荒漠化,25,8.2964
geography\geosqa,geomorphology_geology_hazards,地貌、地质与灾害,geosqa00346,geosqa00346.json,3164,"读图“沿20°经线所作的剖面图”,回答16—18题。 <image1> G山的成因是",读图“沿 20° 经线所作的剖面图”，回答 16—18 题。<image1> G 山的成因是什么？,human_curated_zh,亚欧板块与非洲板块碰撞形成的,25,7.5677
